<?xml version="1.0" encoding="UTF-8"?>
<!DOCTYPE sqlResults PUBLIC "-//GemStone Systems, Inc.//GemFireXD Test Results 1.0//EN"
          "sqlResults1_0.dtd">
<sqlResults>
	<resultSet id="q_1">
		<row>
			<field name="1">22</field>	
		</row>
		<row>	
			<field name="1">24</field>
		</row>
		<row>		
			<field name="1">26</field>
			
		</row>
		<row>		
			<field name="1">28</field>			
		</row>
	</resultSet>
	
	<resultSet id="q_2">
		<row>
			<field name="ID">11</field>
			<field name="SECURITY_ID">char11</field>	
		</row>
		<row>	
			<field name="ID">12</field>
			<field name="SECURITY_ID">char12</field>	
		</row>
		<row>		
			<field name="ID">13</field>
			<field name="SECURITY_ID">char13</field>	
			
		</row>
		<row>		
			<field name="ID">14</field>
			<field name="SECURITY_ID">char14</field>				
		</row>
	</resultSet>
	
	<resultSet id="q_3">
		<row>
			<field name="1">20</field>				
		</row>		
	</resultSet>
	
	<resultSet id="q_4">
		<row>
			<field name="1">1</field>				
		</row>		
	</resultSet>
</sqlResults>
