<?xml version="1.0" encoding="UTF-8"?>
<!DOCTYPE sqlResults PUBLIC "-//GemStone Systems, Inc.//GemFireXD Test Results 1.0//EN"
          "sqlResults1_0.dtd">
<sqlResults>
        <resultSet id="q_1">
                <row>
                        <field name="CID">10</field>
                </row>
                <row>
                        <field name="CID">20</field>
                </row>
                <row>
                        <field name="CID">30</field>
                </row>
                <row>
                        <field name="CID">40</field>
                </row>
                <row>
                        <field name="CID">50</field>
                </row>
                <row>
                        <field name="CID">60</field>
                </row>
                <row>
                        <field name="CID">70</field>
                </row>
                <row>
                        <field name="CID">80</field>
                </row>
                <row>
                        <field name="CID">90</field>
                </row>
                <row>
                        <field name="CID">100</field>
                </row>
                <row>
                        <field name="CID">110</field>
                </row>
                <row>
                        <field name="CID">120</field>
                </row>
                 <row>
                        <field name="CID">130</field>
                </row>
                <row>
                        <field name="CID">140</field>
                </row>
                <row>
                        <field name="CID">150</field>
                </row>
                <row>
                        <field name="CID">160</field>
                </row>
                <row>
                        <field name="CID">170</field>
                </row>
                <row>
                        <field name="CID">180</field>
                </row>
        </resultSet>


        <resultSet id="q_2">
                <row>
                        <field name="CID">10</field>
                </row>
                <row>
                        <field name="CID">20</field>
                </row>
                <row>
                        <field name="CID">30</field>
                </row>
                <row>
                        <field name="CID">40</field>
                </row>
                <row>
                        <field name="CID">50</field>
                </row>
                <row>
                        <field name="CID">60</field>
                </row>
                <row>
                        <field name="CID">70</field>
                </row>
                <row>
                        <field name="CID">80</field>
                </row>
                <row>
                        <field name="CID">90</field>
                </row>
                <row>
                        <field name="CID">100</field>
                </row>
                <row>
                        <field name="CID">110</field>
                </row>
                <row>
                        <field name="CID">120</field>
                </row>
                 <row>
                        <field name="CID">130</field>
                </row>
                <row>
                        <field name="CID">140</field>
                </row>
                <row>
                        <field name="CID">150</field>
                </row>
                <row>
                        <field name="CID">160</field>
                </row>
                <row>
                        <field name="CID">170</field>
                </row>
                <row>
                        <field name="CID">180</field>
                </row>
                <row>
                        <field name="CID">190</field>
                </row>
        </resultSet>

        <resultSet id="q_3">
                <row>
                        <field name="CID">10</field>
                </row>
                <row>
                        <field name="CID">20</field>
                </row>
                <row>
                        <field name="CID">30</field>
                </row>
                <row>
                        <field name="CID">40</field>
                </row>
                <row>
                        <field name="CID">50</field>
                </row>
                <row>
                        <field name="CID">60</field>
                </row>
                <row>
                        <field name="CID">70</field>
                </row>
                <row>
                        <field name="CID">80</field>
                </row>
                <row>
                        <field name="CID">90</field>
                </row>
                <row>
                        <field name="CID">100</field>
                </row>
                <row>
                        <field name="CID">110</field>
                </row>
                <row>
                        <field name="CID">120</field>
                </row>
                 <row>
                        <field name="CID">130</field>
                </row>
                <row>
                        <field name="CID">140</field>
                </row>
                <row>
                        <field name="CID">150</field>
                </row>
                <row>
                        <field name="CID">160</field>
                </row>
                <row>
                        <field name="CID">170</field>
                </row>
                <row>
                        <field name="CID">180</field>
                </row>

        </resultSet>

        <resultSet id="q_4">
                <row>
                        <field name="CID">10</field>
                </row>
        </resultSet>


        <resultSet id="q_5">
                <row>
                        <field name="CID">10</field>
                </row>
                <row>
                        <field name="CID">20</field>
                </row>
        </resultSet>

</sqlResults>
