<?xml version="1.0" encoding="UTF-8"?>
<!DOCTYPE sqlResults PUBLIC "-//GemStone Systems, Inc.//GemFireXD Test Results 1.0//EN"
          "sqlResults1_0.dtd">
<sqlResults>
	<resultSet id="empty"/>

	<resultSet id="ddl-dist1">
		<row>
			<field name="NAME">TEST</field>
		</row>
	</resultSet>
        <resultSet id="ddl-altered">
                <row>
                        <field name="NAME">TEST</field>
                        <field name="MAXWRITEONLYFILESIZE">47</field>
                        <field name="WRITEONLYFILEROLLOVERINTERVALSECS">20820</field>
                        <field name="MAXINPUTFILECOUNT">98</field>
                        <field name="MAXINPUTFILESIZE">38</field>
                        <field name="MININPUTFILECOUNT">24</field>
                        <field name="MINORCOMPACT">false</field>
                        <field name="MAJORCOMPACTIONINTERVALMINS">372</field>
                        <field name="MAJORCOMPACT">false</field>
                        <field name="PURGEINTERVALMINS">2392</field>
                        <field name="BATCHSIZE">23</field>
                        <field name="BATCHTIMEINTERVALMILLIS">2000</field>
                        <field name="MINORCOMPACTIONTHREADS">35</field>
                        <field name="MAJORCOMPACTIONTHREADS">29</field>
                        
                </row>
        </resultSet>
        <resultSet id="ddl-original">
                <row>
                        <field name="NAME">TEST</field>
                        <field name="MAXWRITEONLYFILESIZE">256</field>
                        <field name="WRITEONLYFILEROLLOVERINTERVALSECS">3600</field>
                        <field name="MAXINPUTFILECOUNT">10</field>
                        <field name="MAXINPUTFILESIZE">512</field>
                        <field name="MININPUTFILECOUNT">4</field>
                        <field name="MINORCOMPACT">true</field>
                        <field name="MAJORCOMPACTIONINTERVALMINS">720</field>
                        <field name="MAJORCOMPACT">true</field>
                        <field name="PURGEINTERVALMINS">30</field>
                        <field name="BATCHSIZE">32</field>
                        <field name="BATCHTIMEINTERVALMILLIS">60000</field>
                        <field name="MINORCOMPACTIONTHREADS">10</field>
                        <field name="MAJORCOMPACTIONTHREADS">2</field>
                        
                </row>
        </resultSet>
</sqlResults>
